id,q_id,method,retrieve_text,score,source
8d877c6d7bc749e4b5cbe8e8698bf7ab,14,滑動視窗,"台灣自主遙測衛星「福衛八號」以6＋2顆組成星系，相較於目前僅有一顆的「福衛五號」，涵蓋的時間與覆蓋率都會提升。吳宗信表示，遙測繼續不斷進步，以前只要拍到就好，但現在除了拍到，還要能拍得更清晰，甚至造訪上空的間隔更短。
根據國家太空中心提供的資料，「福衛八號」第一顆衛星「齊柏林衛星」，編號FS-8A，自2017年開始規劃，研發費用2億元、造價3億元，屬於「第三期國家太空科技發展長程計畫」251億元的其中一部分。",0.65771484375,data_05.txt
5d41e603a41348febc4ee19707599803,15,滑動視窗,"消失的住院醫師
健保兆元時代，擋得住「直美」風潮與急重難科持續失血嗎？
醫院急重症人力崩塌持續擴大，20年前的內外婦兒「四大皆空」、10年前變成內外婦兒急「五大皆空」，到了今年（2025），甚至因為神經內科24小時取栓的過勞、也引發出走潮，再累加至內外婦兒急神經「六大皆空」。
《報導者》2024年年底推出《誰掏空了醫院人力》專題，以數據資料解析30年最大一波的護理人力出走潮，離開的護理師去哪裡？哪些醫院最留不住人？同時揭露，自費診所3年開了300家，成為急重症科人力巨大的磁石。",0.66455078125,data_03.txt
a0e2c454f1744daea0f34afa475fe156,16,滑動視窗,但也有聲音質疑，既然衛星發射都仰賴馬斯克（Elon Musk）旗下美國太空探索科技公司（SpaceX）的火箭，為什麼不連同遙測影像都跟美國購買就好？況且美國衛星技術也比台灣自主研發的更先進？吳宗信說明，每一顆衛星每天要做什麼事都需要排程，從地面下指令讓遙測衛星來執行，當經過的地點有很多事情要做的時候，就得依照優先順序，若只依靠跟美國購買遙測影像，「台灣要情蒐的影像有比美國（自己的）重要嗎？」吳宗信指出：「我們願意多花多少錢將排序往前挪？愈精細的影像要價愈貴，甚至關乎國家安全的重要事項，通常都是各國自製衛星的第一要務，購買方即使出再多錢都不見得能擠進去。」,0.7646484375,data_05.txt
b33233e976ae4cbb97d65b7becddce76,17,滑動視窗,然而，不以專科發展為目標的年輕住院醫師，不進入醫院的選擇是什麼？由日本創造出來的名詞「直美」（Chokubi）、醫學生畢業後直接進入醫美巿場是潮流之一。「直美」規模與影響究竟有多大？在醫療生態系裡，直美醫師的誘因與風險又是什麼？我們有官方的數據以及同樣面臨這股「直美風暴」的日、韓專家跨國採訪，大家思考的防範或改革手段是什麼？我們也找到台灣首代直美醫師，他不設防的真心話，讓大家看見選擇直美醫師的多層意象。,0.75927734375,data_03.txt
5c32da58c58a4a5dabbc43267cc8c5cd,18,滑動視窗,"由於放射性落塵中的核分裂產物半衰期差異大，因此造成長期的輻射殘留。有些核分裂產物半衰期極短，只有幾分之一秒，但少數的半衰期長到可在數年內對人類及環境構成威脅。

例如放射性物質「鍶-90」半衰期達28年，會在生物骨骼中積聚，並導致腫瘤、白血病和其他血液疾病；銫-137的半衰期為30年，可能導致生殖腺輻射暴露與基因損傷；鈽-​​239半衰期則長達2.44萬年，即使只攝取1微克，也會造成骨骼及肺部腫瘤等嚴重危害。

此外，也有學者指出，這些放射性同位素會殘留在土壤及水中，進而入侵動植物體內、在食物鏈累積。德國一項對野豬體內銫污染的研究發現，其中有68%可追溯至全球各地進行的核試驗。",0.75537109375,data_04.txt
373c26277175458f9e82491608f16a07,19,滑動視窗,"報告也分析，美、俄、英、法、中國、印度、巴基斯坦、北韓及以色列等9個擁核國，都仍計畫擴增核武庫，並退出軍備控制協議，加上美俄之間最後一份協議《新削減戰略武器條約》將於2026年2月到期，代表全球已開啟新一輪核武威脅時代。

如今的核武威脅達到冷戰以來的高峰，世界地緣政治局勢也比以往任何時候更動盪不安。",0.82275390625,data_04.txt
cb655da0f82342e68a9d29744ee5aa38,20,滑動視窗,"福衛八號．任重高飛
用科技實力守護台灣：「福衛八號」升空，有哪些不能言說的國安任務？",0.66796875,data_05.txt
a806154005e945118ce152076e0c5ac7,1,語意切塊,"台灣的太空之眼：「福衛八號」進擊之路

回到地面，我們看到的這些衛星影像，來自國家太空中心一座不眠不休的機房，他們把衛星回傳的一包包數據，解碼、校正、重組成可以被讀懂的地表語言，比如崩塌的山坡、被海水淹沒的村落、油汙蔓延的海岸線。

如今，這套技術不僅讓台灣能夠監測自己的土地，也能讓我們在世界各地發生災害的第一時間，即時提供關鍵資訊，衛星影像正在成為台灣參與國際的新語言。

從太空到地表的連線：衛星傳輸後的影像處理中心解碼、校正
走進國家太空中心的影像處理中心，隔著玻璃窗，我們看見機房裡頭擺放著20多櫃資料處理系統，其中包含3部超級電腦，這些電腦的用途是針對衛星進行任務排程、資料管理、接收，以及成像處理與品質驗證。接下來當「齊柏林衛星」完成拍攝、將資料傳回地面接收站後，影像處理中心人員就會將這些訊號數據解碼、校正與重組，拼貼成一幀幀能夠講述地表故事的照片。",0.50634765625,data_02.txt
48f0130c9c6644b6b34fde183eadf507,2,語意切塊,"。
2026年，台灣的全民健保進入「兆元時代」，儘管要追趕超高齡人口的速度、高科技和新藥價格的飆漲，仍然吃力，但這個規模已近台灣中央總預算的三分之一，台灣健保投資已追上國民所得相近的國家。我們專訪新任衛福部長石崇良，他開出的首波改革與重整之道，正是對準醫療人力盤點與直美設限，企圖把全民負擔的健保集中火力投在最需要的醫療缺口上，新官上任後的政策支票是否合理，各界可以擴大討論，並且從現在開始，監督可行政策兌現的速度。",0.67919921875,data_03.txt
5abe8e13af6d433993d1a68ad35ce595,3,語意切塊,"2025年極端大旱的結果，讓伊朗的農業陷入絕境，農村破產讓伊朗社會的貧困問題加倍嚴重，農作歉收也進一步推升了因政治局勢而通膨失控的民生物價。同時，水庫缺水導致的發電停擺，也讓伊朗各大城市不僅面臨限水，還得面對比往年更加嚴重的限電窘境。
在天災、人禍與戰爭風險同步包夾的多重壓力下，伊朗社會的痛苦指數終於在2025年底攀升至臨界點。儘管伊朗政府為了舒緩民怨，試圖釋放改革訊號，並局部放寬過去因宗教理由而設下的娛樂禁令與部分社會限制，但在國內經濟瀕臨崩潰的現實下，既憤怒又絕望的伊朗民眾即便明知政府必會回應以暴力鎮壓，仍選擇走上街頭，群起掀起一波足以動搖威權統治的抗爭巨浪。",0.62744140625,data_01.txt
4f2e62c00172448896994a36c3931759,4,語意切塊,"儘管在社群平台上的聲量不低，但芮沙．巴勒維的「家族背景」，也讓他難以成為能夠凝聚共識的政治人物。作為前國王巴勒維（Mohammad Reza Pahlavi）的長子，芮沙．巴勒維從出生以來就一直過著外界難以想像的驕奢生活──據說巴勒維國王為了慶祝長子誕生，曾下令在伊朗各大城市上空空投玫瑰花瓣。在巴勒維王朝末年，伊朗國內同樣苦於貧富差距極端化、民生經濟崩潰、政府暴力鎮壓異議示威，國王委以大權卻極為貪婪與殘酷的祕密警察單位「薩瓦克」（Savak），更曾是伊朗人民恨之入骨的暴政象徵。

但巴勒維王朝的覆滅，已經是47年前的往事。對於國民年齡中位數只有34歲、6成人口都在40歲以下的現代伊朗而言，舊王朝的威權暴政已是上一代的陌生歷史，但對伊朗伊斯蘭共和國的失望與憤怒卻還是現實裡的日常進行式。因此，當伊朗街頭響起「讓巴勒維王朝回來統治我們」、「國王萬歲！」之際，這些口號反映的其實不是對君主統治的懷念與擁戴，而更像是一種情緒性的宣洩──一種對1979年革命與伊朗伊斯蘭共和國的全面否定與挑釁。",0.75927734375,data_01.txt
31bdfbc79ed648138787bd3ba50b8ca2,5,語意切塊,"精細影像堆疊，OSINT可解析軍事動作與戰術
最被大眾熟知與常被使用的遙測影像是Google Earth，彙整多家遙測影像的虛擬地球，便於使用者操作，遙測影像藉由資訊科技的進步，變成人人可及的資訊。現年26歲、就讀台灣師範大學東亞學系碩士班的溫約瑟，22歲時靠著善用這些公開資訊製作出「解放軍基地與設施地圖」一夕爆紅，他所使用的衛星遙測影像就包括Google Earth、歐盟哥白尼（Copernicus）的哨兵（Sentinel）衛星、微軟Bing Maps與Apple Maps等，加上查證所完成──這樣的技術稱為公開來源情報（Open Source Intelligence, OSINT），美國國家情報總監（Director of National Intelligence, DNI）定義為「專門從公開或商業可用資訊中獲取的情報，目的在解決特定的情報事項或要求」",0.69677734375,data_05.txt
977cb87941564b3db7fe11cadf0fc2d1,6,語意切塊,"林穎佑進一步解釋，「當我國想要關注東風15或16的部署時，會與美國首要關注長程飛彈截然不同，優先順序怎麼安排？美國衛星當然會以他們自己的需求為主，這就是現實。如果台灣能擁有遙測衛星影像，那與美國進行情報交換就能做到互補效果，」他指出，「我們的優勢是在第一島鏈，距離解放軍很近，取得的資訊也跟美國很不一樣，應該是要互補而不是競爭；他幫我們看照其他部分，我們提供他們近海的研析資訊。」
對於國安，吳宗信更是罕見願意多談，他舉例：「更精細的遙測衛星可以拍到油槽上方陰影，而陰影的深淺可以利用三維分析出油槽是滿油還是空槽，長期關注下，在敵方戰備時就能預先研判。」在國防安全上，遙測衛星可以做的情蒐工作還有很多。

下一步：國安單位衛星影像的理解能力亟需「升級」
除了國家太空中心之外，早在1993年成立的中央大學太空遙測中心（CSRSR）也會接受衛星影像，目前可以接受除了自主的「福衛五號」之外，還能還可接收法國SPOT-6/7、及Pléiades 1A/1B的光學遙測影像。",0.59521484375,data_05.txt
0f066b0daf634ad28cab53952a19ab61,7,語意切塊,"2025年6月22日，民眾在美國華盛頓特區的白宮外舉辦反戰集會，譴責美國對伊朗核設施的空襲，其中一位示威者手持寫有「中東不要新戰爭」的反戰標語。（攝影／Probal Rashid／LightRocket via Getty Images）
范斯等人的意見，反映出的是美國政壇主流對於「再次出兵中東」的政治忌憚。一來，是因為美國目前可採取的行動選項有限，包括提供網路支援、突破伊朗政府對Starlink的信號干擾、再次空襲伊朗革命衛隊的指揮基地，甚至是空降突襲對最高領袖哈米尼發動「斬首行動」，都無法達到「一擊逆轉」伊朗國內政局之目的，反而更可能坐實伊朗政府「民眾抗爭是境外勢力煽動叛亂」的指控，使情勢進一步惡化。

此外，美國的中東盟邦──包括沙烏地阿拉伯、阿拉伯聯合大公國（UAE）、科威特、卡達、阿曼與巴林等與伊朗相鄰的海灣石油國家，也都極力勸阻川普攻擊伊朗。",0.66650390625,data_01.txt
2e88fb9e413143639a6a67b03466cd27,8,語意切塊,"二戰後全球發動逾2千次核試驗 誰是蕈狀雲下的犧牲者？
二戰結束後，至少有8國執行超過2千次核試驗，地點大多選在偏遠地帶或離島。這些核試驗場周遭的居民，至今仍因暴露在輻射下導致疾病，或被迫離開家園，刻下無法抹滅的傷痕。如今美國總統川普一度宣布重啟核試，世界局勢愈發緊張，又是誰將承擔輻射的代價？
爆炸發生幾小時後，人們就抓破自己的皮膚，母親們眼睜睜地看著孩子們的頭髮都掉在地上，水泡在一夜之間吞噬了他們的身體。

基爾瑪——馬紹爾群島核委會主席
80年前，美國向日本廣島和長崎投下2顆原子彈結束二次世界大戰，當下造成約11萬人喪生，卻也開啟核子時代。各國進入冷戰時期後力拚軍備競賽，包含美國、蘇聯、英國、法國及中國等國，都爭相研製威力更大的核武。

根據美國軍備控制協會統計，自1945年以來，至少有8國在數十處試驗場執行共2056次核試爆，其中520次是早期直接在大氣中引爆，導致放射性物質在大氣層擴散；也有少數在水下進行，已知8次；此外還有1528次在地下引爆，在土壤中留下污染。",0.7001953125,data_04.txt
51cb75c676074821aefd441a2a1a1ee7,9,語意切塊,"舉例來說，2023年菲律賓民都洛近海油輪「MT Princess Empress」沉沒造成大規模漏油汙染，衝擊當地海洋生態。台灣調度「福衛五號」協助產出連續油汙範圍判釋圖，支援汙染擴散追蹤與岸線清理決策；2024年日本石川縣能登半島發生規模7.6的地震，後續引發海嘯，太空中心亦協助進行視覺化與數值化分析，觀察海岸、山區土石變化，以及房屋倒塌狀況，估算出實際災害面積。


「福衛五號」針對日本石川能登半島地震影像分析（原始出處／國家太空中心；設計／江世民）
而當台灣遭遇災害事件時，同樣也能透過守望亞洲計畫尋求協助。例如今年7月底，台灣中南部因西南氣流挾帶豪大雨導致嚴重淹水與斷電，太空中心在第一時間發出緊急觀測需求，日本宇宙航空研究開發機構（JAXA）、印度太空研究組織便協同上傳災前災後影像，協助台灣進行地貌分析。

除了守望亞洲計畫外，太空中心近年亦與國際合作發展基金會合作，調度「福衛五號」協助友邦瓜地馬拉、貝里斯監測農作物生長面積範圍與農作物葉片顏色變化，藉此分析病蟲害，這項計畫執行3年，已成功協助友邦防治，避免面臨重大農損。",0.74951171875,data_02.txt
a008ac0e94c64b8fbd0beeb7e5ec4625,10,語意切塊,"。
2026年，台灣的全民健保進入「兆元時代」，儘管要追趕超高齡人口的速度、高科技和新藥價格的飆漲，仍然吃力，但這個規模已近台灣中央總預算的三分之一，台灣健保投資已追上國民所得相近的國家。我們專訪新任衛福部長石崇良，他開出的首波改革與重整之道，正是對準醫療人力盤點與直美設限，企圖把全民負擔的健保集中火力投在最需要的醫療缺口上，新官上任後的政策支票是否合理，各界可以擴大討論，並且從現在開始，監督可行政策兌現的速度。",0.69873046875,data_03.txt
0fba45a8c92e471dba2d17aa310ee581,11,語意切塊,"根據一段2026年1月9日至11日間拍攝的影片截圖，伊朗首都德黑蘭郊區卡里札克（Kahrizak）的示威活動遭到鎮壓後，民眾在法醫中心外尋找罹難親友的遺體。（攝影／UGC via AP／達志影像）
根據一段2026年1月9日至11日間拍攝的影片截圖，伊朗首都德黑蘭郊區卡里札克（Kahrizak）的示威活動遭到鎮壓後，民眾在法醫中心外尋找罹難親友的遺體。（攝影／UGC via AP／達志影像）
伊朗政府為了阻斷示威者彼此串聯而切斷全國網路與行動通訊，其封鎖強度更是前所未有。事實上，早在2019年11月的伊朗反油價調漲抗爭期間，伊朗政府就曾實施過「全國斷網」。但與當年相比，這一回伊朗政府不僅切斷了伊朗與全球網際網路的連線，國內的手機行動通訊，甚至包括Starlink等不受伊朗政府許可與管轄的低軌衛星通訊系統，也都同步遭到封鎖。",0.8291015625,data_01.txt
d228a6a729b34f478570aee38a1e2e2a,12,語意切塊,"「福衛八號」的酬載任務，還包括這次「齊柏林衛星」搭載「雙波段大氣瞬變影像儀」與「電子溫度密度儀」，將科學儀器戴上太空，用於觀測閃電、大氣電學與電離層結構變化。這些酬載主要由成功大學團隊設計，透過衛星平台進行太空驗證，提供大氣電學與物理研究的第一手資料。

國家太空中心更已著手進行「福衛九號」計畫。「福衛九號」將採用「全天候高解析度微波遙測技術」，這樣的技術具備穿透雲層的能力，即使在夜晚或厚雲覆蓋下仍能清晰成像，「福衛九號」將與「福衛八號」的光學遙測衛星互補，構建更完整的對地觀測系統，預計於2027年、2029年發射。

從「福衛五號」、「福衛八號」到即將問世的「福衛九號」，台灣正在嘗試在太空中打造自己的視野。當太空產業自主、資料可控，台灣才能在關鍵時刻不仰賴他人，用自己的眼睛，守護自己的天空。",0.74072265625,data_02.txt
84a8a6600dcc4414a23c9fe6fa0c3eb9,13,語意切塊,"美國當初花費1.05億美元（逾台幣30億元），將超過7.3萬立方公尺的放射性碎片，倒進馬紹爾群島核爆形成的彈坑中，並用巨大的混凝土穹頂覆蓋，被稱為「魯尼特圓頂」。

美國官方在1980年拍攝的魯尼特圓頂。（圖／法新社資料照）

然而，如今穹頂已出現結構弱化跡象，在海平面上升的壓力下可能產生裂縫。美國政府現在主張，建造此坑洞只是為了儲放核廢料，而非保護周遭環境免受污染。

「新一輪核武威脅時代」將來臨？
瑞典智庫斯德哥爾摩國際和平研究所（SIPRI）發布《2025全球核力量年鑑》指出，截至2025年1月，全球約有1萬2241枚核彈頭，其中9614枚屬可供實際部署的軍事庫存，且約有2100枚已搭載在彈道飛彈上，代表處於高度戰備狀態。

報告也分析，美、俄、英、法、中國、印度、巴基斯坦、北韓及以色列等9個擁核國，都仍計畫擴增核武庫，並退出軍備控制協議，加上美俄之間最後一份協議《新削減戰略武器條約》將於2026年2月到期，代表全球已開啟新一輪核武威脅時代。

如今的核武威脅達到冷戰以來的高峰，世界地緣政治局勢也比以往任何時候更動盪不安。",0.7197265625,data_04.txt
a2c004300c15461abd2612bbb3358401,14,語意切塊,"福衛八號．任重高飛
用科技實力守護台灣：「福衛八號」升空，有哪些不能言說的國安任務？
台灣發展衛星計畫，主要分成科學酬載、氣象衛星、遙測衛星三大類，其中遙測衛星已從最早的「福爾摩沙衛星二號」（簡稱「福衛二號」），進入還在服役的「福爾摩沙衛星五號」（簡稱「福衛五號」），以及預計在2025年11月29日發射的「福爾摩沙衛星八號」（簡稱「福衛八號」），它們除了守護台灣之外，其實還有一項重要的國安任務──總統賴清德在出席「福衛八號」起運至美國的典禮中也提到「國家安全」──靠著長期累積的取像，能進行更多情報研析，甚至解讀解放軍的各種軍事動作。這些工作長期以來「只能做不能說」，《報導者》這次專訪國家太空中心（TASA）談起這項國安任務，並訪問軍事專家分析，未來「福衛八號」搭配其他商用衛星，能幫台灣的國家安全做什麼？
2025年7月，「福衛八號」正在緊鑼密鼓進行各項測試時，《報導者》獲准進入國家太空中心整測廠房採訪",0.626953125,data_05.txt
dfec15fd4b48452d887639bdd22cda4e,15,語意切塊,"消失的住院醫師
健保兆元時代，擋得住「直美」風潮與急重難科持續失血嗎？
醫院急重症人力崩塌持續擴大，20年前的內外婦兒「四大皆空」、10年前變成內外婦兒急「五大皆空」，到了今年（2025），甚至因為神經內科24小時取栓的過勞、也引發出走潮，再累加至內外婦兒急神經「六大皆空」。
《報導者》2024年年底推出《誰掏空了醫院人力》專題，以數據資料解析30年最大一波的護理人力出走潮，離開的護理師去哪裡？哪些醫院最留不住人？同時揭露，自費診所3年開了300家，成為急重症科人力巨大的磁石。
數月後我們持續追蹤，醫院人力失血沒有止住，今年度各大醫院多個困難科住院醫師招收持續創新低，我們取得專科醫學會的資料、走訪醫學中心現場，由專家依臨床照顧人力需求指引，完整呈現醫療人力走勢：哪些是人力極度缺乏的紅區、哪裡是拉警報的黃區、哪裡又是搶破頭的綠區？此外，更深度下探不同專科內嚴重的「科內不均」現象，大專科人力總額不足辨識真正乏人問津、卻不能沒有的次專科分布，衛福部和醫策會長年未完成真正的醫療人力盤點與調查，《報導者》整合多個資料，讓台灣次專科分布圖輪廓首度被看見",0.671875,data_03.txt
0a9dcce9680a4a7eb1603b6df4380674,16,語意切塊,"為什麼花錢也買不到「需要的情蒐」？
國家太空中心公布「齊柏林衛星」光學解析度可拍攝到距離地面近達1公尺的影像，國科會主委吳誠文在起運典禮上表示，「前兩顆衛星會是同樣的解析度，接下來的衛星將朝解析度70公分甚至50公分邁進，利用科技實力守護台灣。」

但也有聲音質疑，既然衛星發射都仰賴馬斯克（Elon Musk）旗下美國太空探索科技公司（SpaceX）的火箭，為什麼不連同遙測影像都跟美國購買就好？況且美國衛星技術也比台灣自主研發的更先進？吳宗信說明，每一顆衛星每天要做什麼事都需要排程，從地面下指令讓遙測衛星來執行，當經過的地點有很多事情要做的時候，就得依照優先順序，若只依靠跟美國購買遙測影像，「台灣要情蒐的影像有比美國（自己的）重要嗎？」吳宗信指出：「我們願意多花多少錢將排序往前挪？愈精細的影像要價愈貴，甚至關乎國家安全的重要事項，通常都是各國自製衛星的第一要務，購買方即使出再多錢都不見得能擠進去。」",0.74560546875,data_05.txt
b33e5a19c6fc4f99871cb52d40ba4c55,17,語意切塊,"。
然而，不以專科發展為目標的年輕住院醫師，不進入醫院的選擇是什麼？由日本創造出來的名詞「直美」（Chokubi）、醫學生畢業後直接進入醫美巿場是潮流之一。「直美」規模與影響究竟有多大？在醫療生態系裡，直美醫師的誘因與風險又是什麼？我們有官方的數據以及同樣面臨這股「直美風暴」的日、韓專家跨國採訪，大家思考的防範或改革手段是什麼？我們也找到台灣首代直美醫師，他不設防的真心話，讓大家看見選擇直美醫師的多層意象。
今年8月歐洲醫醫學教育學會上，特別針對「困難招生科別」進行分享，與直美一樣，這也是全球性的問題，即便在醫師人均比和醫療健保資源相對充足的歐洲國家，急性照護人力也在流失，各國經驗的是：改善年輕醫師的薪資與環境很重要、但價值的支持與醫學教育也很重要，必須讓社會重新看見醫療的「role model」。我們專訪3位艱困科的留守醫師，從他們選擇留下的理由，試圖讓大眾重新看見：醫療的價值與真諦。而守護這個價值的任務，不只是醫師本身、更是全體社會",0.72314453125,data_03.txt
d3a616f908034a86a3d3e2ae58eb8b4c,18,語意切塊,"例如放射性物質「鍶-90」半衰期達28年，會在生物骨骼中積聚，並導致腫瘤、白血病和其他血液疾病；銫-137的半衰期為30年，可能導致生殖腺輻射暴露與基因損傷；鈽-​​239半衰期則長達2.44萬年，即使只攝取1微克，也會造成骨骼及肺部腫瘤等嚴重危害。

此外，也有學者指出，這些放射性同位素會殘留在土壤及水中，進而入侵動植物體內、在食物鏈累積。德國一項對野豬體內銫污染的研究發現，其中有68%可追溯至全球各地進行的核試驗。

「核試爆能量是7232顆廣島原子彈」 馬紹爾成回不去的家園
1946年至1958年間，美國在馬紹爾群島進行了約66次核試驗，釋放能量相當於7232顆廣島原子彈。

美國國家癌症研究所推估，1948年至1970年間住在馬紹爾群島的居民罹患的癌症，有0.4%至3.4%可能由輻射暴露引起；對直接接觸到放射性落塵的居民來說，比例最高更達69%。

美國當時將居住於核試驗場附近的馬紹爾居民遷至美國本土，即使在1970及1980年代曾試圖讓他們返回，但由於部分島嶼仍有輻射污染，有些人至今未能重返家園。",0.7421875,data_04.txt
