id,q_id,method,retrieve_text,score,source
99bb51e2cd7840a2adb2aefbbb28946b,19,語意切塊,"美國當初花費1.05億美元（逾台幣30億元），將超過7.3萬立方公尺的放射性碎片，倒進馬紹爾群島核爆形成的彈坑中，並用巨大的混凝土穹頂覆蓋，被稱為「魯尼特圓頂」。

美國官方在1980年拍攝的魯尼特圓頂。（圖／法新社資料照）

然而，如今穹頂已出現結構弱化跡象，在海平面上升的壓力下可能產生裂縫。美國政府現在主張，建造此坑洞只是為了儲放核廢料，而非保護周遭環境免受污染。

「新一輪核武威脅時代」將來臨？
瑞典智庫斯德哥爾摩國際和平研究所（SIPRI）發布《2025全球核力量年鑑》指出，截至2025年1月，全球約有1萬2241枚核彈頭，其中9614枚屬可供實際部署的軍事庫存，且約有2100枚已搭載在彈道飛彈上，代表處於高度戰備狀態。

報告也分析，美、俄、英、法、中國、印度、巴基斯坦、北韓及以色列等9個擁核國，都仍計畫擴增核武庫，並退出軍備控制協議，加上美俄之間最後一份協議《新削減戰略武器條約》將於2026年2月到期，代表全球已開啟新一輪核武威脅時代。

如今的核武威脅達到冷戰以來的高峰，世界地緣政治局勢也比以往任何時候更動盪不安。",0.578125,data_04.txt
3161d74eb4354a70ba330e8d4aa8bb9c,20,語意切塊,"對台灣而言，我們強大的衛星影像處理能力已成為一種實質的外交工具，平時我們運用衛星影像協助各國進行農業、民生與國土變化的動態判釋；災時，台灣也能憑藉自主、細緻的衛星資源與影像判讀判讀能力，成為資料提供者與分析者，把太空影像轉化為可行動的救災資訊。

「福衛九號」計畫啟動：全天候觀測，追求關鍵畫面不漏接
「福衛八號」預計於2031年前完成星系布建，現已規劃陸續接替「福衛五號」的遙測任務。「福衛八號」最大的特色在於它是台灣第一個以建構自主產業鏈為核心目標打造的衛星星系，從結構材料、推進次系統到光學鏡頭，整體系統84%的關鍵元件、57項核心技術由國內研製完成，幾乎涵蓋了整個衛星製造流程，展示台灣目標打入國際太空產業的決心。

除了持續為台灣進行國土監測與災害應變外，「福衛八號」也將展現在國家安全、科學研究等面向發揮更完整的功能。國家太空中心主任吳宗信舉例，高解析度的影像能用來大面積監測中國海警船等船隻的動態，並與自動識別系統（AIS）資料比對，以偵測那些關閉訊號、從事非法行動的「暗目標」，「甚至我們在影像處理能使用AI去進行監控和預警，搭配起來會對國家安全、經濟活動有戰略保護的功能。」",0.66845703125,data_02.txt
